{
  "kind": "file",
  "verifier_clock": 1757419200000,
  "outcome": "authentic",
  "labels": [
    "integrity unevaluated",
    "key not in transparency log",
    "no trusted time",
    "not anchored",
    "origin not hardware-attested",
    "timestamp evidence invalid",
    "watermark not evaluated"
  ],
  "not_evaluated": [],
  "core_hash": "dc59127e528a04d6e285de3abe748559e49c7f1ef66b238092a6b13afeeb5119",
  "level": {
    "claimed": "tee",
    "proven": "none",
    "ceiling": "amber"
  },
  "validated_at": {
    "instant": "2025-09-08T12:00:00.000Z",
    "source": "device_clock"
  },
  "schema_valid": true
}
