{
  "kind": "container",
  "outcome": "frames_not_compared",
  "labels": [
    "integrity unevaluated",
    "key not in transparency log",
    "no trusted time",
    "no watermark",
    "not anchored",
    "origin not hardware-attested",
    "segment content not recomputed"
  ],
  "not_evaluated": [],
  "core_hash": "b93395d8a811f5b2511a9ce4009518b6b662a54ce0e12c3afb10c903cbe81b83",
  "segments": {
    "verified": []
  },
  "schema_valid": true
}
