{
  "kind": "container",
  "outcome": "authentic",
  "labels": [
    "integrity unevaluated",
    "key not in transparency log",
    "no trusted time",
    "not anchored",
    "origin not hardware-attested",
    "watermark not evaluated"
  ],
  "not_evaluated": [],
  "segments": {
    "verified": [
      0,
      1,
      2,
      3,
      4,
      5,
      6,
      7,
      8,
      9,
      10
    ]
  },
  "level": {
    "claimed": "secureEnclave",
    "proven": "none",
    "ceiling": "amber"
  },
  "validated_at": {
    "instant": "2026-09-12T13:33:31.443Z",
    "source": "device_clock"
  },
  "location": {
    "claimed": "none",
    "level": "none"
  },
  "core_hash": "ba4b822c8f05d1ffae71a0c8ae7ceb62fa5caf440545301100c71c0ab2956ad9",
  "schema_valid": true
}
