{
  "kind": "file",
  "verifier_clock": 1757419200000,
  "chain_read": {
    "root": "kGY3IDqmtseaWzNC_4hB6I3bTYRvqvF5Ggilel8aYMg",
    "tree_size": 3,
    "block_time": 1757332830000
  },
  "outcome": "authentic",
  "labels": [
    "integrity unevaluated",
    "key not in transparency log",
    "location declared only",
    "no trusted time",
    "origin not hardware-attested",
    "timestamp evidence invalid",
    "watermark not evaluated"
  ],
  "not_evaluated": [],
  "core_hash": "dc59127e528a04d6e285de3abe748559e49c7f1ef66b238092a6b13afeeb5119",
  "level": {
    "claimed": "tee",
    "proven": "none",
    "ceiling": "amber"
  },
  "validated_at": {
    "instant": "2025-09-08T12:00:30.000Z",
    "source": "anchor"
  },
  "schema_valid": true
}
